,movie_title,genre,overview,director,cast,runtime,imdb_rating,meta_score,votes,Gross,release_year
732,Red River,Drama Western,Dunson leads a cattle drive the culmination of over 14 years of work to its destination in Missouri But his tyrannical behavior along the way causes a mutiny led by his adopted son,Howard Hawks,"['Arthur Rosson', 'John Wayne', 'Montgomery Clift', 'Joanne Dru', 'Walter Brennan']",133,7.8,96,"32,931",,1948
733,Bir Zamanlar Anadolu'da,Crime Drama Thriller,A group of men set out in search of a dead body in the Anatolian steppes,Nuri Bilge Ceylan,"['Muhammet Uzuner', 'Yilmaz Erdogan', 'Taner Birsel', 'Ahmet Mümtaz Taylan']",157,7.8,82,"48,277","138,730",2011
734,The Innocents,Horror,A young governess for two children becomes convinced that the house and grounds are haunted,Jack Clayton,"['Deborah Kerr', 'Peter Wyngarde', 'Megs Jenkins', 'Michael Redgrave']",100,7.8,88,"31,876","2,616,000",1961
735,Les choristes,Comedy Drama Music,The new teacher at a severely administered boys boarding school works to positively affect the students lives through music,Christophe Barratier,"['Gérard Jugnot', 'François Berléand', 'Jean-Baptiste Maunier', 'Kad Merad']",97,7.8,,"65,016","3,635,164",2004
736,Bride of Frankenstein,Drama Horror SciFi,Mary Shelley reveals the main characters of her novel survived Dr Frankenstein goaded by an even madder scientist builds his monster a mate,James Whale,"['Boris Karloff', 'Elsa Lanchester', 'Colin Clive', 'Valerie Hobson']",75,7.8,95,"50,837","4,360,000",1935
737,Cowboy Bebop: Tengoku no tobira,Animation Action Crime,A terrorist explosion releases a deadly virus on the masses and its up to the bountyhunting Bebop crew to catch the coldblooded culprit,Shin'ichirô Watanabe,"['Mary Elizabeth McGlynn', 'Tensai Okamura', 'Hiroyuki Okiura', 'Yoshiyuki Takei', 'Beau Billingslea', 'Melissa Fahn', 'Nicholas Guest', 'Kôichi Yamadera']",115,7.8,61,"51,034","1,000,045",2001
738,Dip huet seung hung,Action Crime Drama,A disillusioned assassin accepts one last hit in hopes of using his earnings to restore vision to a singer he accidentally blinded,John Woo,"['Chow Yun-Fat', 'Danny Lee', 'Sally Yeh', 'Kong Chu']",111,7.8,82,"49,821",,1989
739,Tôkyô goddofâzâzu,Animation Adventure Comedy,On Christmas Eve three homeless people living on the streets of Tokyo discover a newborn baby among the trash and set out to find its parents,Satoshi Kon,"['Tôru Emori', 'Yoshiaki Umegaki', 'Aya Okamoto', 'Shôzô Îzuka']",92,7.8,74,"43,632","128,985",2003
740,Le charme discret de la bourgeoisie,Comedy,A surreal virtually plotless series of dreams centered around six middleclass people and their consistently interrupted attempts to have a meal together,Luis Buñuel,"['Fernando Rey', 'Delphine Seyrig', 'Paul Frankeur', 'Bulle Ogier']",102,7.8,93,"45,163","198,809",1972
741,The Asphalt Jungle,Crime Drama FilmNoir,A major heist goes off as planned but then double crosses bad luck and solid police work cause everything to unravel,John Huston,"['Sterling Hayden', 'Louis Calhern', 'Jean Hagen', 'James Whitmore']",112,7.8,85,"28,722",,1950
742,Il postino,Biography Comedy Drama,A simple Italian postman learns to love poetry while delivering mail to a famous poet and then uses this to woo local beauty Beatrice,Michael Radford,"['Massimo Troisi', 'Massimo Troisi', 'Philippe Noiret', 'Maria Grazia Cucinotta', 'Renato Scarpa']",108,7.8,81,"37,965","21,848,932",1994
743,Crimes and Misdemeanors,Comedy Drama,An ophthalmologists mistress threatens to reveal their affair to his wife while a married documentary filmmaker is infatuated with another woman,Woody Allen,"['Martin Landau', 'Woody Allen', 'Bill Bernstein', 'Claire Bloom']",104,7.8,77,"59,595","18,254,702",1989
744,Sennen joyû,Animation Drama Fantasy,A TV interviewer and his cameraman meet a former actress and travel through her memories and career,Satoshi Kon,"['Miyoko Shôji', 'Shôzô Îzuka', 'Mami Koyama', 'Fumiko Orikasa']",87,7.8,70,"30,103","186,094",2001
745,You Can't Take It with You,Comedy Drama Romance,The son of a snobbish Wall Street banker becomes engaged to a woman from a goodnatured but decidedly eccentric family not realizing that his father is trying to force her family from their home for a real estate development,Frank Capra,"['Jean Arthur', 'James Stewart', 'Lionel Barrymore', 'Edward Arnold']",126,7.8,,"26,933","4,659,913",1938
746,Soshite chichi ni naru,Drama,Ryota is a successful workaholic businessman When he learns that his biological son was switched with another boy after birth he faces the difficult decision to choose his true son or the boy he and his wife have raised as their own,Hirokazu Koreeda,"['Masaharu Fukuyama', 'Machiko Ono', 'Yôko Maki', 'Lily Franky']",121,7.8,73,"26,717","278,442",2013
747,Veer-Zaara,Drama Family Musical,VeerZaara is a saga of love separation courage and sacrifice A love story that is an inspiration and will remain a legend forever,Yash Chopra,"['Shah Rukh Khan', 'Preity G Zinta', 'Rani Mukerji', 'Kirron Kher']",192,7.8,67,"55,239","2,921,738",2004
748,Ma vie de Courgette,Animation Comedy Drama,After losing his mother a young boy is sent to an orphanage with other orphans his age where he begins to learn the meaning of trust and true love,Claude Barras,"['Gaspard Schlatter', 'Sixtine Murat', 'Paulin Jaccoud', 'Michel Vuillermoz']",66,7.8,85,"27,370","292,279",2016
749,Vivre sa vie: Film en douze tableaux,Drama,Twelve episodic tales in the life of a Parisian woman and her slow descent into prostitution,Jean-Luc Godard,"['Anna Karina', 'Sady Rebbot', 'André S. Labarthe', 'Guylaine Schlumberger']",80,7.8,,"33,760",,1962
750,Duck Soup,Comedy Musical,Rufus T Firefly is named the dictator of bankrupt Freedonia and declares war on neighboring Sylvania over the love of his wealthy backer Mrs Teasdale contending with two inept spies who cant seem to keep straight which side theyre on,Leo McCarey,"['Groucho Marx', 'Harpo Marx', 'Chico Marx', 'Zeppo Marx']",69,7.8,93,"61,639",,1933
751,Knockin' on Heaven's Door,Action Crime Comedy,Two terminally ill patients escape from a hospital steal a car and rush towards the sea,Thomas Jahn,"['Til Schweiger', 'Jan Josef Liefers', 'Thierry van Werveke', 'Moritz Bleibtreu']",87,7.8,,"32,384","3,296",1997
752,A Night at the Opera,Comedy Music Musical,A sly business manager and the wacky friends of two opera singers in Italy help them achieve success in America while humiliating their stuffy and snobbish enemies,Sam Wood,"['Edmund Goulding', 'Groucho Marx', 'Chico Marx', 'Harpo Marx', 'Kitty Carlisle']",96,7.8,,"33,894","2,537,520",1935
753,English Vinglish,Comedy Drama Family,A quiet sweet tempered housewife endures small slights from her welleducated husband and daughter every day because of her inability to speak and understand English,Gauri Shinde,"['Sridevi', 'Adil Hussain', 'Mehdi Nebbou', 'Priya Anand']",134,7.8,,"37,773","1,670,773",2012
754,Hindi Medium,Comedy Drama,A couple from Chandni Chowk aspire to give their daughter the best education and thus be a part of and accepted by the elite of Delhi,Saket Chaudhary,"['Irrfan Khan', 'Saba Qamar', 'Dishita Sehgal', 'Deepak Dobriyal']",132,7.8,,"30,870",,2017
755,Vicky Donor,Comedy Romance,A man is brought in by an infertility doctor to supply him with his sperm where he becomes the biggest sperm donor for his clinic,Shoojit Sircar,"['Ayushmann Khurrana', 'Yami Gautam', 'Annu Kapoor', 'Dolly Ahluwalia']",126,7.8,,"44,530","169,209",2012
756,Mission: Impossible - Fallout,Action Adventure Thriller,Ethan Hunt and his IMF team along with some familiar allies race against time after a mission gone wrong,Christopher McQuarrie,"['Tom Cruise', 'Henry Cavill', 'Ving Rhames', 'Simon Pegg']",147,7.7,86,"357,851","220,159,104",2018
757,The Whale,Drama,A reclusive morbidly obese English teacher attempts to reconnect with his estranged teenage daughter,Darren Aronofsky,"['Brendan Fraser', 'Sadie Sink', 'Ty Simpkins', 'Hong Chau']",117,7.7,,"164,914",,2022
758,The Goonies,Adventure Comedy Family,A group of young misfits called The Goonies discover an ancient map and set out on an adventure to find a legendary pirates longlost treasure,Richard Donner,"['Sean Astin', 'Josh Brolin', 'Jeff Cohen', 'Corey Feldman']",114,7.7,62,"287,460","61,503,218",1985
759,The Banshees of Inisherin,Comedy Drama,Two lifelong friends find themselves at an impasse when one abruptly ends their relationship with alarming consequences for both of them,Martin McDonagh,"['Colin Farrell', 'Brendan Gleeson', 'Kerry Condon', 'Pat Shortt']",114,7.7,87,"219,377",,2022
760,A Few Good Men,Drama Thriller,Military lawyer Lieutenant Daniel Kaffee defends Marines accused of murder They contend they were acting under orders,Rob Reiner,"['Tom Cruise', 'Jack Nicholson', 'Demi Moore', 'Kevin Bacon']",138,7.7,62,"276,279","141,340,178",1992
761,Aftersun,Drama,Sophie reflects on the shared joy and private melancholy of a holiday she took with her father twenty years earlier Memories real and imagined fill the gaps between as she tries to reconcile the father she knew with the man she didnt,Charlotte Wells,"['Paul Mescal', 'Frankie Corio', 'Celia Rowlson-Hall', 'Sally Messham']",102,7.7,95,"69,704",,2022
762,Zodiac,Crime Drama Mystery,Between 1968 and 1983 a San Francisco cartoonist becomes an amateur detective obsessed with tracking down the Zodiac Killer an unidentified individual who terrorizes Northern California with a killing spree,David Fincher,"['Jake Gyllenhaal', 'Robert Downey Jr.', 'Mark Ruffalo', 'Anthony Edwards']",157,7.7,79,"568,287","33,080,084",2007
763,Kingsman: The Secret Service,Action Adventure Comedy,A spy organisation recruits a promising street kid into the agencys training program while a global threat emerges from a twisted tech genius,Matthew Vaughn,"['Colin Firth', 'Taron Egerton', 'Samuel L. Jackson', 'Michael Caine']",129,7.7,,"692,572","128,261,724",2014
764,Harry Potter and the Goblet of Fire,Adventure Family Fantasy,Harry Potter finds himself competing in a hazardous tournament between rival schools of magic but he is distracted by recurring nightmares,Mike Newell,"['Daniel Radcliffe', 'Emma Watson', 'Rupert Grint', 'Eric Sykes']",157,7.7,81,"652,690","290,013,036",2005
765,The Count of Monte Cristo,Action Adventure Drama,A young man falsely imprisoned by his jealous friend escapes and uses a hidden treasure to exact his revenge,Kevin Reynolds,"['Jim Caviezel', 'Guy Pearce', 'Christopher Adamson', 'JB Blanc']",131,7.7,61,"143,941","54,234,062",2002
766,The Hangover,Comedy,Three buddies wake up from a bachelor party in Las Vegas with no memory of the previous night and the bachelor missing They make their way around the city in order to find their friend before his wedding,Todd Phillips,"['Zach Galifianakis', 'Bradley Cooper', 'Justin Bartha', 'Ed Helms']",100,7.7,73,"814,949","277,322,503",2009
767,Black Hawk Down,Action Drama History,The story of 160 elite US soldiers who dropped into Mogadishu in October 1993 to capture two top lieutenants of a renegade warlord but found themselves in a desperate battle with a large force of heavily armed Somalis,Ridley Scott,"['Josh Hartnett', 'Ewan McGregor', 'Tom Sizemore', 'Eric Bana']",144,7.7,74,"410,531","108,638,745",2001
768,Man on Fire,Action Crime Drama,In Mexico City a former CIA operative swears vengeance on those who committed an unspeakable act against the family he was hired to protect,Tony Scott,"['Denzel Washington', 'Christopher Walken', 'Dakota Fanning', 'Radha Mitchell']",146,7.7,,"374,794","77,911,774",2004
769,(500) Days of Summer,Comedy Drama Romance,After being dumped by the girl he believes to be his soulmate hopeless romantic Tom Hansen reflects on their relationship to try and figure out where things went wrong and how he can win her back,Marc Webb,"['Zooey Deschanel', 'Joseph Gordon-Levitt', 'Geoffrey Arend', 'Chloë Grace Moretz']",95,7.7,76,"535,437","32,391,374",2009
770,Coraline,Animation Drama Family,An adventurous 11yearold girl finds another world that is a strangely idealized version of her frustrating home but it has sinister secrets,Henry Selick,"['Dakota Fanning', 'Teri Hatcher', 'John Hodgman', 'Jennifer Saunders']",100,7.7,80,"246,872","75,286,229",2009
771,La vie d'Adèle,Drama Romance,Adles life is changed when she meets Emma a young woman with blue hair who will allow her to discover desire and to assert herself as a woman and as an adult In front of others Adle grows seeks herself loses herself and ultimately finds herself through love and loss,Abdellatif Kechiche,"['Léa Seydoux', 'Adèle Exarchopoulos', 'Salim Kechiouche', 'Aurélien Recoing']",180,7.7,90,"158,259","2,199,675",2013
772,Airplane!,Comedy,After the crew becomes sick with food poisoning a neurotic exfighter pilot must land a commercial airplane full of passengers safely,Jim Abrahams,"['David Zucker', 'Jerry Zucker', 'Robert Hays', 'Julie Hagerty', 'Leslie Nielsen', 'Kareem Abdul-Jabbar']",88,7.7,78,"250,811","83,400,000",1980
773,Primal Fear,Crime Drama Mystery,An altar boy is accused of murdering a priest and the truth is buried several layers deep,Gregory Hoblit,"['Richard Gere', 'Laura Linney', 'Edward Norton', 'John Mahoney']",129,7.7,,"235,568","56,116,183",1996
774,Ocean's Eleven,Crime Thriller,Danny Ocean and his ten accomplices plan to rob three Las Vegas casinos simultaneously,Steven Soderbergh,"['George Clooney', 'Brad Pitt', 'Julia Roberts', 'Matt Damon']",116,7.7,74,"596,754","183,417,150",2001
775,Apollo 13,Adventure Drama History,NASA must devise a strategy to return Apollo 13 to Earth safely after the spacecraft undergoes massive internal damage putting the lives of the three astronauts on board in jeopardy,Ron Howard,"['Tom Hanks', 'Bill Paxton', 'Kevin Bacon', 'Gary Sinise']",140,7.7,77,"305,661","173,837,933",1995
776,Ex Machina,Drama SciFi Thriller,A young programmer is selected to participate in a groundbreaking experiment in synthetic intelligence by evaluating the human qualities of a highly advanced humanoid AI,Alex Garland,"['Alicia Vikander', 'Domhnall Gleeson', 'Oscar Isaac', 'Sonoya Mizuno']",108,7.7,78,"565,947","25,442,958",2014
777,Harry Potter and the Deathly Hallows: Part 1,Adventure Family Fantasy,As Harry Ron and Hermione race against time and evil to destroy the Horcruxes they uncover the existence of the three most powerful objects in the wizarding world the Deathly Hallows,David Yates,"['Daniel Radcliffe', 'Emma Watson', 'Rupert Grint', 'Bill Nighy']",146,7.7,65,"573,221","295,983,305",2010
778,Home Alone,Comedy Family,An eightyearold troublemaker mistakenly left home alone must defend his home against a pair of burglars on Christmas eve,Chris Columbus,"['Macaulay Culkin', 'Joe Pesci', 'Daniel Stern', 'John Heard']",103,7.7,63,"608,545","285,761,243",1990
779,Druk,Drama,Four highschool teachers consume alcohol on a daily basis to see how it affects their social and professional lives,Thomas Vinterberg,"['Mads Mikkelsen', 'Thomas Bo Larsen', 'Magnus Millang', 'Lars Ranthe']",117,7.7,79,"177,761",,2020
780,Wind River,Crime Drama Mystery,A wildlife officer who is haunted by a tragedy that happened because of him teams up with an FBI agent in solving a murder of a young woman on a Wyoming Native American reservation and hopes to get redemption from his past regrets,Taylor Sheridan,"['Elizabeth Olsen', 'Jeremy Renner', 'Graham Greene', 'Kelsey Asbille']",107,7.7,73,"265,229","33,800,859",2017
781,Brokeback Mountain,Drama Romance,Ennis and Jack are two shepherds who develop a sexual and emotional relationship Their relationship becomes complicated when both of them get married to their respective girlfriends,Ang Lee,"['Jake Gyllenhaal', 'Heath Ledger', 'Michelle Williams', 'Randy Quaid']",134,7.7,87,"370,214","83,043,761",2005
782,Blue Velvet,Crime Drama Mystery,The discovery of a severed human ear found in a field leads a young man on an investigation related to a beautiful mysterious nightclub singer and a group of psychopathic criminals who have kidnapped her child,David Lynch,"['Isabella Rossellini', 'Kyle MacLachlan', 'Dennis Hopper', 'Laura Dern']",120,7.7,76,"207,872","8,551,228",1986
783,Training Day,Action Crime Drama,A rookie cop spends his first day as a Los Angeles narcotics officer with a rogue detective who isnt what he appears to be,Antoine Fuqua,"['Denzel Washington', 'Ethan Hawke', 'Scott Glenn', 'Tom Berenger']",122,7.7,69,"453,725","76,631,907",2001
784,X: First Class,Action SciFi,In the 1960s superpowered humans Charles Xavier and Erik Lensherr work together to find others like them but Eriks vengeful pursuit of an ambitious mutant who ruined his life causes a schism to divide them,Matthew Vaughn,"['James McAvoy', 'Michael Fassbender', 'Jennifer Lawrence', 'Kevin Bacon']",131,7.7,65,"708,608","146,408,305",2011
785,Gravity,Drama SciFi Thriller,Two astronauts work together to survive after an accident leaves them stranded in space,Alfonso Cuarón,"['Sandra Bullock', 'George Clooney', 'Ed Harris', 'Orto Ignatiussen']",91,7.7,96,"844,483","274,092,705",2013
786,Star Trek Into Darkness,Action Adventure SciFi,After the crew of the Enterprise find an unstoppable force of terror from within their own organization Captain Kirk leads a manhunt to a warzone world to capture a oneman weapon of mass destruction,J.J. Abrams,"['Chris Pine', 'Zachary Quinto', 'Zoe Saldana', 'Benedict Cumberbatch']",132,7.7,72,"491,074","228,778,661",2013
787,First Blood,Action Adventure Thriller,A veteran Green Beret is forced by a cruel Sheriff and his deputies to flee into the mountains and wage an escalating oneman war against his pursuers,Ted Kotcheff,"['Sylvester Stallone', 'Brian Dennehy', 'Richard Crenna', 'Bill McKinney']",93,7.7,61,"264,595","47,212,904",1982
788,Lost in Translation,Comedy Drama,A faded movie star and a neglected young woman form an unlikely bond after crossing paths in Tokyo,Sofia Coppola,"['Bill Murray', 'Scarlett Johansson', 'Giovanni Ribisi', 'Anna Faris']",102,7.7,91,"470,276","44,585,453",2003
789,Blazing Saddles,Comedy Western,In order to ruin a western town a corrupt politician appoints a black Sheriff who promptly becomes his most formidable adversary,Mel Brooks,"['Cleavon Little', 'Gene Wilder', 'Slim Pickens', 'Harvey Korman']",93,7.7,73,"146,225","119,500,000",1974
790,Silver Linings Playbook,Comedy Drama Romance,After a stint in a mental institution former teacher Pat Solitano moves back in with his parents and tries to reconcile with his exwife Things get more challenging when Pat meets Tiffany a mysterious girl with problems of her own,David O. Russell,"['Bradley Cooper', 'Jennifer Lawrence', 'Robert De Niro', 'Jacki Weaver']",122,7.7,81,"725,533","132,092,958",2012
791,The Game,Drama Mystery Thriller,After a wealthy San Francisco banker is given an opportunity to participate in a mysterious game his life is turned upside down as he begins to question if it might really be a concealed conspiracy to destroy him,David Fincher,"['Michael Douglas', 'Deborah Kara Unger', 'Sean Penn', 'James Rebhorn']",129,7.7,63,"412,552","48,323,648",1997
792,Mr. Nobody,Drama Fantasy Romance,A boy stands on a station platform as a train is about to leave Should he go with his mother or stay with his father Infinite possibilities arise from this decision As long as he doesnt choose anything is possible,Jaco Van Dormael,"['Jared Leto', 'Sarah Polley', 'Diane Kruger', 'Linh-Dan Pham']",141,7.7,63,"240,310","3,600",2009
793,Y tu mamá también,Drama,In Mexico two teenage boys and an attractive older woman embark on a road trip and learn a thing or two about life friendship sex and each other,Alfonso Cuarón,"['Maribel Verdú', 'Gael García Bernal', 'Daniel Giménez Cacho', 'Ana López Mercado']",106,7.7,89,"126,354","13,622,333",2001
794,The Last of the Mohicans,Action Adventure Drama,Three trappers protect the daughters of a British Colonel in the midst of the French and Indian War,Michael Mann,"['Daniel Day-Lewis', 'Madeleine Stowe', 'Russell Means', 'Eric Schweig']",112,7.7,76,"179,195","75,505,856",1992
795,Birdman or (The Unexpected Virtue of Ignorance),Comedy Drama,A washedup superhero actor attempts to revive his fading career by writing directing and starring in a Broadway production,Alejandro G. Iñárritu,"['Michael Keaton', 'Zach Galifianakis', 'Edward Norton', 'Andrea Riseborough']",119,7.7,87,"649,143","42,340,598",2014
796,Donnie Brasco,Biography Crime Drama,An FBI undercover agent infiltrates the mob and finds himself identifying more with the mafia life at the expense of his regular one,Mike Newell,"['Al Pacino', 'Johnny Depp', 'Michael Madsen', 'Bruno Kirby']",127,7.7,76,"319,414","41,909,762",1997
797,Tangled,Animation Adventure Comedy,The magically longhaired Rapunzel has spent her entire life in a tower but now that a runaway thief has stumbled upon her she is about to discover the world for the first time and who she really is,Nathan Greno,"['Byron Howard', 'Mandy Moore', 'Zachary Levi', 'Donna Murphy', 'Ron Perlman']",100,7.7,71,"473,979","200,821,936",2010
798,3:10 to Yuma,Action Crime Drama,A smalltime rancher agrees to hold a captured outlaw whos awaiting a train to go to court in Yuma A battle of wills ensues as the outlaw tries to psych out the rancher,James Mangold,"['Russell Crowe', 'Christian Bale', 'Ben Foster', 'Logan Lerman']",122,7.7,76,"322,841","53,606,916",2007
799,Deliverance,Adventure Drama Thriller,Intent on seeing the Cahulawassee River before its dammed and turned into a lake outdoor fanatic Lewis Medlock takes his friends on a canoeing trip theyll never forget into the dangerous American backcountry,John Boorman,"['Jon Voight', 'Burt Reynolds', 'Ned Beatty', 'Ronny Cox']",109,7.7,80,"115,376","7,056,013",1972
800,Halloween,Horror Thriller,Fifteen years after murdering his sister on Halloween night 1963 Michael Myers escapes from a mental hospital and returns to the small town of Haddonfield Illinois to kill again,John Carpenter,"['Donald Pleasence', 'Jamie Lee Curtis', 'Tony Moran', 'Nancy Kyes']",91,7.7,87,"290,783","47,000,000",1978
801,The Boondock Saints,Action Thriller,Two Irish Catholic brothers become vigilantes and wipe out Bostons criminal underworld in the name of God,Troy Duffy,"['Willem Dafoe', 'Sean Patrick Flanery', 'Norman Reedus', 'David Della Rocco']",108,7.7,,"244,538","25,812",1999
802,The Lego Movie,Animation Action Adventure,An ordinary LEGO construction worker thought to be the prophesied as special is recruited to join a quest to stop an evil tyrant from gluing the LEGO universe into eternal stasis,Phil Lord,"['Christopher Miller', 'Chris Pratt', 'Will Ferrell', 'Elizabeth Banks', 'Will Arnett']",100,7.7,83,"374,538","257,760,692",2014
803,Who Framed Roger Rabbit,Animation Adventure Comedy,A toonhating detective is a cartoon rabbits only hope to prove his innocence when he is accused of murder,Robert Zemeckis,"['Bob Hoskins', 'Christopher Lloyd', 'Joanna Cassidy', 'Charles Fleischer']",104,7.7,83,"209,742","156,452,370",1988
804,"O Brother, Where Art Thou?",Adventure Comedy Crime,In the deep south during the 1930s three escaped convicts search for hidden treasure while a relentless lawman pursues them,Joel Coen,"['Ethan Coen', 'George Clooney', 'John Turturro', 'Tim Blake Nelson', 'John Goodman']",107,7.7,69,"321,876","45,512,588",2000
805,What's Eating Gilbert Grape,Drama,A young man in a small Midwestern town struggles to care for his mentallydisabled younger brother and morbidly obese mother while attempting to pursue his own happiness,Lasse Hallström,"['Johnny Depp', 'Leonardo DiCaprio', 'Juliette Lewis', 'Mary Steenburgen']",118,7.7,73,"245,841","9,170,214",1993
806,Wreck-It Ralph,Animation Adventure Comedy,A video game villain wants to be a hero and sets out to fulfill his dream but his quest brings havoc to the whole arcade where he lives,Rich Moore,"['John C. Reilly', 'Jack McBrayer', 'Jane Lynch', 'Sarah Silverman']",101,7.7,72,"441,541","189,422,889",2012
807,Detachment,Drama,A substitute teacher who drifts from classroom to classroom finds a connection to the students and teachers during his latest assignment,Tony Kaye,"['Adrien Brody', 'Christina Hendricks', 'Marcia Gay Harden', 'Lucy Liu']",98,7.7,,"93,150","71,177",2011
808,Argo,Biography Drama Thriller,Acting under the cover of a Hollywood producer scouting a location for a science fiction film a CIA agent launches a dangerous operation to rescue six Americans in Tehran during the US hostage crisis in Iran in 1979,Ben Affleck,"['Ben Affleck', 'Bryan Cranston', 'John Goodman', 'Alan Arkin']",120,7.7,86,"627,673","136,025,503",2012
809,Sense and Sensibility,Drama Romance,Rich Mr Dashwood dies leaving his second wife and her three daughters poor by the rules of inheritance The two eldest daughters are the title opposites,Ang Lee,"['Emma Thompson', 'Kate Winslet', 'James Fleet', 'Tom Wilkinson']",136,7.7,84,"121,005","43,182,776",1995
810,Toy Story 4,Animation Adventure Comedy,When a new toy called Forky joins Woody and the gang a road trip alongside old and new friends reveals how big the world can be for a toy,Josh Cooley,"['Tom Hanks', 'Tim Allen', 'Annie Potts', 'Tony Hale']",100,7.7,84,"266,004","434,038,008",2019
811,Midnight in Paris,Comedy Fantasy Romance,While on a trip to Paris with his fiances family a nostalgic screenwriter finds himself mysteriously going back to the 1920s every day at midnight,Woody Allen,"['Owen Wilson', 'Rachel McAdams', 'Kathy Bates', 'Kurt Fuller']",94,7.7,81,"437,508","56,816,662",2011
812,Sound of Metal,Drama Music,A heavy metal drummers life is turned upside down when he begins to lose his hearing and he must confront a future filled with silence,Darius Marder,"['Riz Ahmed', 'Olivia Cooke', 'Paul Raci', 'Lauren Ridloff']",120,7.7,82,"139,462",,2019
