,movie_title,genre,overview,director,cast,runtime,imdb_rating,meta_score,votes,Gross,release_year
489,The Perks of Being a Wallflower,Drama,Charlie a 15yearold introvert enters high school and is nervous about his new life When he befriends his seniors he learns to cope with his friends suicide and his tumultuous past,Stephen Chbosky,"['Logan Lerman', 'Emma Watson', 'Ezra Miller', 'Paul Rudd']",103,7.9,67,"530,776","17,742,948",2012
490,The Man from Earth,Drama Fantasy Mystery,An impromptu goodbye party for Professor John Oldman becomes a mysterious interrogation after the retiring scholar reveals to his colleagues he has a longer and stranger past than they can imagine,Richard Schenkman,"['David Lee Smith', 'Tony Todd', 'John Billingsley', 'Ellen Crawford']",87,7.9,,"193,800",,2007
491,Shaun of the Dead,Comedy Horror,The uneventful aimless lives of a London electronics salesman and his layabout roommate are disrupted by the zombie apocalypse,Edgar Wright,"['Simon Pegg', 'Nick Frost', 'Kate Ashfield', 'Lucy Davis']",99,7.9,76,"575,623","13,542,874",2004
492,Shrek,Animation Adventure Comedy,A mean lord exiles fairytale creatures to the swamp of a grumpy ogre who must go on a quest and rescue a princess for the lord in order to get his land back,Andrew Adamson,"['Vicky Jenson', 'Mike Myers', 'Eddie Murphy', 'Cameron Diaz', 'John Lithgow']",90,7.9,84,"705,910","267,665,011",2001
493,E.T. the Extra-Terrestrial,Adventure Family SciFi,A troubled child summons the courage to help a friendly alien escape from Earth and return to his home planet,Steven Spielberg,"['Henry Thomas', 'Drew Barrymore', 'Peter Coyote', 'Dee Wallace']",115,7.9,92,"423,801","435,110,554",1982
494,X-Men: Days of Future Past,Action Adventure SciFi,The XMen send Wolverine to the past in a desperate effort to change history and prevent an event that results in doom for both humans and mutants,Bryan Singer,"['Patrick Stewart', 'Ian McKellen', 'Hugh Jackman', 'James McAvoy']",132,7.9,75,"729,162","233,921,534",2014
495,Mystic River,Crime Drama Mystery,The lives of three men who were childhood friends are shattered when one of them has a family tragedy,Clint Eastwood,"['Sean Penn', 'Tim Robbins', 'Kevin Bacon', 'Emmy Rossum']",138,7.9,84,"470,393","90,135,191",2003
496,Thor: Ragnarok,Action Adventure Comedy,Imprisoned on the planet Sakaar Thor must race against time to return to Asgard and stop Ragnark the destruction of his world at the hands of the powerful and ruthless villain Hela,Taika Waititi,"['Chris Hemsworth', 'Tom Hiddleston', 'Cate Blanchett', 'Mark Ruffalo']",130,7.9,74,"784,912","315,058,289",2017
497,District 9,Action SciFi Thriller,Violence ensues after an extraterrestrial race forced to live in slumlike conditions on Earth finds a kindred spirit in a government agent exposed to their biotechnology,Neill Blomkamp,"['Sharlto Copley', 'David James', 'Jason Cope', 'Nathalie Boltt']",112,7.9,81,"698,895","115,646,235",2009
498,The Bourne Identity,Action Mystery Thriller,A man is picked up by a fishing boat bulletriddled and suffering from amnesia before racing to elude assassins and attempting to regain his memory,Doug Liman,"['Franka Potente', 'Matt Damon', 'Chris Cooper', 'Clive Owen']",119,7.9,68,"562,033","121,661,683",2002
499,In Bruges,Comedy Crime Drama,Guiltstricken after a job gone wrong hitman Ray and his partner await orders from their ruthless boss in Bruges Belgium the last place in the world Ray wants to be,Martin McDonagh,"['Colin Farrell', 'Brendan Gleeson', 'Ciarán Hinds', 'Elizabeth Berrington']",107,7.9,67,"448,173","7,757,130",2008
500,Marriage Story,Drama Romance,Noah Baumbachs incisive and compassionate look at a marriage breaking up and a family staying together,Noah Baumbach,"['Adam Driver', 'Scarlett Johansson', 'Julia Greer', 'Azhy Robertson']",137,7.9,94,"328,565","2,000,000",2019
501,Children of Men,Action Drama SciFi,In 2027 in a chaotic world in which women have somehow become infertile a former activist agrees to help transport a miraculously pregnant woman to a sanctuary at sea,Alfonso Cuarón,"['Julianne Moore', 'Clive Owen', 'Chiwetel Ejiofor', 'Michael Caine']",109,7.9,84,"514,351","35,552,383",2006
502,The Blues Brothers,Action Adventure Comedy,Jake Blues rejoins with his brother Elwood after being released from prison but the duo has just days to reunite their old RB band and save the Catholic home where the two were raised outrunning the police as they tear through Chicago,John Landis,"['John Belushi', 'Dan Aykroyd', 'Cab Calloway', 'John Candy']",133,7.9,,"207,249","57,229,890",1980
503,Dallas Buyers Club,Biography Drama,In 1985 Dallas electrician and hustler Ron Woodroof works around the system to help AIDS patients get the medication they need after he is diagnosed with the disease,Jean-Marc Vallée,"['Matthew McConaughey', 'Jennifer Garner', 'Jared Leto', 'Steve Zahn']",117,7.9,77,"504,034","27,298,285",2013
504,Edward Scissorhands,Drama Fantasy Romance,The solitary life of an artificial man  who was incompletely constructed and has scissors for hands  is upended when he is taken in by a suburban family,Tim Burton,"['Johnny Depp', 'Winona Ryder', 'Dianne Wiest', 'Anthony Michael Hall']",105,7.9,74,"506,496","56,362,352",1990
505,Wonder,Drama Family,Based on the New York Times bestseller this movie tells the incredibly inspiring and heartwarming story of August Pullman a boy with facial differences who enters the fifth grade attending a mainstream elementary school for the first time,Stephen Chbosky,"['Jacob Tremblay', 'Owen Wilson', 'Izabela Vidovic', 'Julia Roberts']",113,7.9,66,"171,913","132,422,809",2017
506,The Big Sleep,Crime FilmNoir Mystery,Private detective Philip Marlowe is hired by a wealthy family Before the complex case is over hes seen murder blackmail and what might be love,Howard Hawks,"['Humphrey Bogart', 'Lauren Bacall', 'John Ridgely', 'Martha Vickers']",114,7.9,86,"88,392","6,540,000",1946
507,Life of Pi,Adventure Drama Fantasy,A young man who survives a disaster at sea is hurtled into an epic journey of adventure and discovery While cast away he forms an unexpected connection with another survivor a fearsome Bengal tiger,Ang Lee,"['Suraj Sharma', 'Irrfan Khan', 'Adil Hussain', 'Tabu']",127,7.9,79,"649,357","124,987,023",2012
508,This Is Spinal Tap,Comedy Music,Spinal Tap one of Englands loudest bands is chronicled by film director Marty DiBergi on what proves to be a fateful tour,Rob Reiner,"['Rob Reiner', 'Michael McKean', 'Christopher Guest', 'Kimberly Stringer']",82,7.9,92,"143,507","4,736,202",1984
509,Boyhood,Drama,The life of Mason from early childhood to his arrival at college,Richard Linklater,"['Ellar Coltrane', 'Patricia Arquette', 'Ethan Hawke', 'Elijah Smith']",165,7.9,100,"361,425","25,379,975",2014
510,Spartacus,Adventure Biography Drama,The slave Spartacus survives brutal training as a gladiator and leads a violent revolt against the decadent Roman Republic as the ambitious Crassus seeks to gain power by crushing the uprising,Stanley Kubrick,"['Anthony Mann', 'Kirk Douglas', 'Laurence Olivier', 'Jean Simmons', 'Charles Laughton']",197,7.9,87,"139,285","30,000,000",1960
511,Toy Story 2,Animation Adventure Comedy,When Woody is stolen by a toy collector Buzz and his friends set out on a rescue mission to save Woody before he becomes a museum toy property with his roundup gang Jessie Prospector and Bullseye,John Lasseter,"['Ash Brannon', 'Lee Unkrich', 'Tom Hanks', 'Tim Allen', 'Joan Cusack', 'Kelsey Grammer']",92,7.9,88,"600,612","245,852,179",1999
512,Carlito's Way,Crime Drama Thriller,A Puerto Rican former convict just released from prison pledges to stay away from drugs and violence despite the pressure around him and lead on to a better life outside of NYC,Brian De Palma,"['Al Pacino', 'Sean Penn', 'Penelope Ann Miller', 'John Leguizamo']",144,7.9,66,"225,837","36,948,322",1993
513,The Nightmare Before Christmas,Animation Family Fantasy,Jack Skellington king of Halloween Town discovers Christmas Town but his attempts to bring Christmas to his home causes confusion,Henry Selick,"['Danny Elfman', 'Chris Sarandon', ""Catherine O'Hara"", 'William Hickey']",76,7.9,82,"354,081","75,082,668",1993
514,Kôkaku kidôtai,Animation Action Crime,A cyborg policewoman and her partner hunt a mysterious and powerful hacker called the Puppet Master,Mamoru Oshii,"['Atsuko Tanaka', 'Iemasa Kayumi', 'Akio Ôtsuka', 'Kôichi Yamadera']",83,7.9,76,"149,934","515,905",1995
515,Brazil,Drama SciFi Thriller,A bureaucrat in a dystopic society becomes an enemy of the state as he pursues the woman of his dreams,Terry Gilliam,"['Jonathan Pryce', 'Kim Greist', 'Robert De Niro', 'Katherine Helmond']",132,7.9,84,"206,208","9,929,135",1985
516,The Ten Commandments,Adventure Drama Family,Moses raised as a prince of Egypt in the Pharaohs household learns of his true heritage as a Hebrew and his divine mission as the deliverer of his people from slavery,Cecil B. DeMille,"['Charlton Heston', 'Yul Brynner', 'Anne Baxter', 'Edward G. Robinson']",220,7.9,,"74,749","93,740,000",1956
517,Per un pugno di dollari,Action Drama Western,A wandering gunfighter plays two rival families against each other in a town torn apart by greed pride and revenge,Sergio Leone,"['Clint Eastwood', 'Gian Maria Volontè', 'Marianne Koch', 'Wolfgang Lukschy']",99,7.9,65,"225,091","14,500,000",1964
518,Wo hu cang long,Action Adventure Drama,A young Chinese warrior steals a sword from a famed swordsman and then escapes into a world of romantic adventure with a mysterious man in the frontier of the nation,Ang Lee,"['Chow Yun-Fat', 'Michelle Yeoh', 'Ziyi Zhang', 'Chang Chen']",120,7.9,94,"276,733","128,078,872",2000
519,Charade,Comedy Mystery Romance,Romance and suspense ensue in Paris as a woman is pursued by several men who want a fortune her murdered husband had stolen Whom can she trust,Stanley Donen,"['Cary Grant', 'Audrey Hepburn', 'Walter Matthau', 'James Coburn']",113,7.9,83,"81,927","13,474,588",1963
520,Doctor Zhivago,Drama Romance War,The life of a Russian physician and poet who although married to another falls in love with a political activists wife and experiences hardship during World War I and then the October Revolution,David Lean,"['Omar Sharif', 'Julie Christie', 'Geraldine Chaplin', 'Rod Steiger']",197,7.9,69,"79,876","111,722,000",1965
521,In the Heat of the Night,Drama Mystery Thriller,A black Philadelphia police detective is mistakenly suspected of a local murder while passing through a racially hostile Mississippi town and after being cleared is reluctantly asked by the police chief to investigate the case,Norman Jewison,"['Sidney Poitier', 'Rod Steiger', 'Warren Oates', 'Lee Grant']",110,7.9,76,"80,237","24,379,978",1967
522,Bound by Honor,Crime Drama,Based on the true life experiences of poet Jimmy Santiago Baca the film focuses on stepbrothers Paco and Cruz and their biracial cousin Miklo,Taylor Hackford,"['Damian Chapa', 'Jesse Borrego', 'Benjamin Bratt', 'Enrique Castillo']",180,7.9,,"32,923","4,496,583",1993
523,Before Midnight,Drama Romance,We meet Jesse and Celine nine years on in Greece Almost two decades have passed since their first meeting on that train bound for Vienna,Richard Linklater,"['Ethan Hawke', 'Julie Delpy', 'Seamus Davey-Fitzpatrick', 'Ariane Labed']",109,7.9,94,"166,010","8,114,627",2013
524,Låt den rätte komma in,Drama Fantasy Horror,Oskar an overlooked and bullied boy finds love and revenge through Eli a beautiful but peculiar girl,Tomas Alfredson,"['Kåre Hedebrant', 'Lina Leandersson', 'Per Ragnar', 'Henrik Dahl']",114,7.9,82,"222,173","2,122,065",2008
525,All the President's Men,Drama History Thriller,The Washington Post reporters Bob Woodward and Carl Bernstein uncover the details of the Watergate scandal that leads to President Richard Nixons resignation,Alan J. Pakula,"['Dustin Hoffman', 'Robert Redford', 'Jack Warden', 'Martin Balsam']",138,7.9,84,"121,527","70,600,000",1976
526,Nosferatu,Fantasy Horror,Vampire Count Orlok expresses interest in a new residence and real estate agent Hutters wife,F.W. Murnau,"['Max Schreck', 'Alexander Granach', 'Gustav von Wangenheim', 'Greta Schröder']",94,7.9,,"101,477",,1922
527,The Wrestler,Drama Sport Thriller,A faded professional wrestler must retire but finds his quest for a new life outside the ring a dispiriting struggle,Darren Aronofsky,"['Mickey Rourke', 'Marisa Tomei', 'Evan Rachel Wood', 'Mark Margolis']",109,7.9,80,"314,133","26,236,603",2008
528,Notorious,Drama FilmNoir Romance,The daughter of a convicted Nazi spy is asked by American agents to gather information on a ring of Nazi scientists in South America How far will she have to go to ingratiate herself with them,Alfred Hitchcock,"['Cary Grant', 'Ingrid Bergman', 'Claude Rains', 'Louis Calhern']",102,7.9,100,"104,300","10,464,000",1946
529,Harold and Maude,Comedy Drama Romance,Young rich and obsessed with death Harold finds himself changed forever when he meets lively septuagenarian Maude at a funeral,Hal Ashby,"['Ruth Gordon', 'Bud Cort', 'Vivian Pickles', 'Cyril Cusack']",91,7.9,62,"79,917",,1971
530,Manbiki kazoku,Crime Drama Thriller,On the margins of Tokyo a dysfunctional band of outsiders are united by loyalty a penchant for petty theft and playful grifting When the young son is arrested secrets are exposed that upend their tenuous belowtheradar existence,Hirokazu Koreeda,"['Lily Franky', 'Sakura Ando', 'Kirin Kiki', 'Mayu Matsuoka']",121,7.9,93,"81,644","3,313,513",2018
531,The Searchers,Adventure Drama Western,An American Civil War veteran embarks on a yearslong journey to rescue his niece from the Comanches after the rest of his brothers family is massacred in a raid on their Texas farm,John Ford,"['John Wayne', 'Jeffrey Hunter', 'Vera Miles', 'Ward Bond']",119,7.9,94,"93,353",,1956
532,The Wild Bunch,Action Adventure Drama,An aging group of outlaws look for one last big score as the traditional American West is disappearing around them,Sam Peckinpah,"['William Holden', 'Ernest Borgnine', 'Robert Ryan', ""Edmond O'Brien""]",145,7.9,98,"87,959","12,064,472",1969
533,A Streetcar Named Desire,Drama,Disturbed Blanche DuBois moves in with her sister in New Orleans and is tormented by her brutish brotherinlaw while her reality crumbles around her,Elia Kazan,"['Vivien Leigh', 'Marlon Brando', 'Kim Hunter', 'Karl Malden']",122,7.9,97,"111,770","8,000,000",1951
534,Being There,Comedy Drama,After the death of his employer forces him out of the only home hes ever known a simpleminded sheltered gardener becomes an unlikely trusted advisor to a powerful tycoon and an insider in Washington politics,Hal Ashby,"['Peter Sellers', 'Shirley MacLaine', 'Melvyn Douglas', 'Jack Warden']",130,7.9,83,"75,276","30,177,511",1979
535,Serbuan maut 2: Berandal,Action Crime Thriller,Only a short time after the first raid Rama goes undercover with the thugs of Jakarta and plans to bring down the syndicate and uncover the corruption within his police force,Gareth Evans,"['Iko Uwais', 'Yayan Ruhian', 'Arifin Putra', 'Oka Antara']",150,7.9,71,"128,033","2,627,209",2014
536,Ying xiong,Action Adventure Drama,A defense officer Nameless was summoned by the King of Qin regarding his success of terminating three warriors,Yimou Zhang,"['Jet Li', 'Tony Leung Chiu-wai', 'Maggie Cheung', 'Ziyi Zhang']",120,7.9,85,"185,003","53,710,019",2002
537,Dancer in the Dark,Crime Drama Musical,An Eastern European US immigrant with a love for musicals has to cope with the gradual loss of her vision,Lars von Trier,"['Björk', 'Catherine Deneuve', 'David Morse', 'Peter Stormare']",140,7.9,63,"113,634","4,184,036",2000
538,King Kong,Adventure Horror SciFi,A film crew goes to a tropical island for a location shoot where they capture a colossal ape who takes a shine to their blonde starlet and bring him back to New York City,Merian C. Cooper,"['Ernest B. Schoedsack', 'Fay Wray', 'Robert Armstrong', 'Bruce Cabot', 'Frank Reicher']",100,7.9,92,"88,389","10,000,000",1933
539,Patton,Biography Drama War,The World War II phase of the career of controversial American general George S Patton,Franklin J. Schaffner,"['George C. Scott', 'Karl Malden', 'Stephen Young', 'Michael Strong']",172,7.9,86,"105,608","61,700,000",1970
540,In Cold Blood,Biography Crime Drama,Two excons murder a family in a robbery attempt before going on the run from the authorities The police try to piece together the details of the murder in an attempt to track down the killers,Richard Brooks,"['Robert Blake', 'Scott Wilson', 'John Forsythe', 'Paul Stewart']",134,7.9,89,"27,900",,1967
541,The Killing,Crime Drama FilmNoir,Crook Johnny Clay assembles a fiveman team to plan and execute a daring racetrack robbery,Stanley Kubrick,"['Sterling Hayden', 'Coleen Gray', 'Vince Edwards', 'Jay C. Flippen']",84,7.9,91,"93,522",,1956
542,A Christmas Story,Comedy Family,In the 1940s a young boy named Ralphie Parker attempts to convince his parents teacher and Santa Claus that a Red Ryder Range 200 Shot BB gun really is the perfect Christmas gift,Bob Clark,"['Peter Billingsley', 'Melinda Dillon', 'Darren McGavin', 'Scott Schwartz']",93,7.9,77,"161,345","20,605,209",1983
543,Sing Street,Comedy Drama Music,A boy growing up in Dublin during the 1980s escapes his strained family life by starting a band to impress the mysterious girl he likes,John Carney,"['Ferdia Walsh-Peelo', 'Aidan Gillen', 'Maria Doyle Kennedy', 'Jack Reynor']",106,7.9,79,"97,882","3,237,118",2016
544,Cat on a Hot Tin Roof,Drama,Brick is an alcoholic exfootball player who drinks his days away and resists the affections of his wife A reunion with his terminal father jogs a host of memories and revelations for both father and son,Richard Brooks,"['Elizabeth Taylor', 'Paul Newman', 'Burl Ives', 'Jack Carson']",108,7.9,84,"51,839","17,570,324",1958
545,Once Were Warriors,Crime Drama,A family descended from Maori warriors is bedeviled by a violent father and the societal problems of being treated as outcasts,Lee Tamahori,"['Rena Owen', 'Temuera Morrison', 'Mamaengaroa Kerr-Bell', 'Julian Arahanga']",102,7.9,77,"35,783","2,201,126",1994
546,Togo,Adventure Biography Drama,The story of Togo the sled dog who led the 1925 serum run despite being considered too small and weak to lead such an intense race,Ericson Core,"['Willem Dafoe', 'Julianne Nicholson', 'Christopher Heyerdahl', 'Richard Dormer']",113,7.9,69,"52,532",,2019
547,The Manchurian Candidate,Drama Thriller,An American POW in the Korean War is brainwashed as an unwitting assassin for an international Communist conspiracy,John Frankenheimer,"['Frank Sinatra', 'Laurence Harvey', 'Janet Leigh', 'Angela Lansbury']",126,7.9,94,"77,645",,1962
548,Rope,Crime Drama Mystery,Two men attempt to prove they committed the perfect crime by hosting a dinner party after strangling their former classmate to death,Alfred Hitchcock,"['James Stewart', 'John Dall', 'Farley Granger', 'Dick Hogan']",80,7.9,73,"148,862",,1948
549,The Artist,Comedy Drama Romance,An egomaniacal film star develops a relationship with a young dancer against the backdrop of Hollywoods silent era,Michel Hazanavicius,"['Jean Dujardin', 'Bérénice Bejo', 'John Goodman', 'James Cromwell']",100,7.9,89,"245,468","44,671,682",2011
550,Strangers on a Train,Crime Drama FilmNoir,A psychopath forces a tennis star to comply with his theory that two strangers can get away with murder,Alfred Hitchcock,"['Farley Granger', 'Robert Walker', 'Ruth Roman', 'Leo G. Carroll']",101,7.9,88,"137,599","7,630,000",1951
551,Short Term 12,Drama,A 20something supervising staff member of a residential treatment facility navigates the troubled waters of that world alongside her coworker and longtime boyfriend,Destin Daniel Cretton,"['Brie Larson', 'Frantz Turner', 'John Gallagher Jr.', 'Kaitlyn Dever']",96,7.9,82,"89,946","1,010,414",2013
552,The Philadelphia Story,Comedy Romance,When a rich womans exhusband and a tabloidtype reporter turn up just before her planned remarriage she begins to learn the truth about herself,George Cukor,"['Cary Grant', 'Katharine Hepburn', 'James Stewart', 'Ruth Hussey']",112,7.9,96,"71,870",,1940
553,Le cercle rouge,Crime Drama Thriller,After leaving prison master thief Corey crosses paths with a notorious escapee and an alcoholic former policeman The trio proceed to plot an elaborate heist,Jean-Pierre Melville,"['Alain Delon', 'Bourvil', 'Gian Maria Volontè', 'Yves Montand']",140,7.9,92,"26,910","372,229",1970
554,Trois couleurs: Bleu,Drama Music Mystery,A woman struggles to find a way to live her life after the death of her husband and child,Krzysztof Kieslowski,"['Juliette Binoche', 'Zbigniew Zamachowski', 'Julie Delpy', 'Benoît Régent']",94,7.9,87,"106,821","1,324,974",1993
555,The Lion in Winter,Biography Drama History,1183 AD King Henry IIs three sons all want to inherit the throne but he wont commit to a choice When he allows his imprisoned wife Eleanor of Aquitaine out for a Christmas visit they all variously plot to force him into a decision,Anthony Harvey,"[""Peter O'Toole"", 'Katharine Hepburn', 'Anthony Hopkins', 'John Castle']",134,7.9,,"32,898","22,276,975",1968
556,Harvey,Comedy Drama Fantasy,Due to his insistence that he has an invisible six foottall rabbit for a best friend a whimsical middleaged man is thought by his family to be insane  but he may be wiser than anyone knows,Henry Koster,"['James Stewart', 'Wallace Ford', 'William H. Lynn', 'Victoria Horne']",104,7.9,,"57,082",,1950
557,Hable con ella,Drama Mystery Romance,Two men share an odd friendship while they care for two women who are both in deep comas,Pedro Almodóvar,"['Rosario Flores', 'Javier Cámara', 'Darío Grandinetti', 'Leonor Watling']",112,7.9,86,"115,366","9,357,911",2002
558,Sacrifice,Drama,At the dawn of World War III a man searches for a way to restore peace to the world and finds he must give something in return,Andrei Tarkovsky,"['Erland Josephson', 'Susan Fleetwood', 'Allan Edwall', 'Guðrún Gísladóttir']",149,7.9,,"29,838","300,653",1986
559,Il conformista,Drama,A weakwilled Italian man becomes a fascist flunky who goes abroad to arrange the assassination of his old teacher now a political dissident,Bernardo Bertolucci,"['Jean-Louis Trintignant', 'Stefania Sandrelli', 'Gastone Moschin', 'Enzo Tarascio']",113,7.9,100,"32,343","541,940",1970
560,Arsenic and Old Lace,Comedy Crime Thriller,A Brooklyn writer of books on the futility of marriage risks his reputation after he decides to tie the knot Things get even more complicated when he learns on his wedding day that his beloved maiden aunts are habitual murderers,Frank Capra,"['Cary Grant', 'Priscilla Lane', 'Raymond Massey', 'Jack Carson']",118,7.9,,"73,078",,1944
561,Amour,Drama,Georges and Anne are an octogenarian couple They are cultivated retired music teachers Their daughter also a musician lives in Britain with her family One day Anne has a stroke and the couples bond of love is severely tested,Michael Haneke,"['Jean-Louis Trintignant', 'Emmanuelle Riva', 'Isabelle Huppert', 'Alexandre Tharaud']",127,7.9,95,"103,366","6,739,492",2012
562,Gegen die Wand,Drama Romance,With the intention to break free from the strict familial restrictions a suicidal young woman sets up a marriage of convenience with a fortyyearold addict an act that will lead to an outburst of envious love,Fatih Akin,"['Birol Ünel', 'Sibel Kekilli', 'Güven Kiraç', 'Zarah Jane McKenzie']",121,7.9,78,"56,129",,2004
563,Bin-jip,Crime Drama Romance,A transient young man breaks into empty homes to partake of the vacationing residents lives for a few days,Kim Ki-duk,"['Lee Seung-yun', 'Hee Jae', 'Hyuk-ho Kwon', 'Jin-mo Joo']",88,7.9,72,"56,851","238,507",2004
564,Mildred Pierce,Crime Drama FilmNoir,A hardworking mother inches towards disaster as she divorces her husband and starts a successful restaurant business to support her spoiled daughter,Michael Curtiz,"['Joan Crawford', 'Jack Carson', 'Zachary Scott', 'Eve Arden']",111,7.9,88,"27,587",,1945
565,My Name Is Khan,Adventure Drama Romance,An Indian Muslim man with Aspergers syndrome takes a challenge to speak to the President of the United States seriously and embarks on a crosscountry journey,Karan Johar,"['Shah Rukh Khan', 'Kajol', 'Sheetal Menon', 'Katie Amanda Keane']",165,7.9,,"111,583","4,018,695",2010
566,Darbareye Elly,Drama Mystery,The mysterious disappearance of a kindergarten teacher during a picnic in the north of Iran is followed by a series of misadventures for her fellow travelers,Asghar Farhadi,"['Golshifteh Farahani', 'Shahab Hosseini', 'Taraneh Alidoosti', 'Sajjad Dolati']",119,7.9,87,"55,498","106,662",2009
567,Kal Ho Naa Ho,Comedy Drama Musical,Naina an introverted perpetually depressed girls life changes when she meets Aman But Aman has a secret of his own which changes their lives forever Embroiled in all this is Rohit Nainas best friend who conceals his love for her,Nikkhil Advani,"['Preity G Zinta', 'Shah Rukh Khan', 'Saif Ali Khan', 'Jaya Bachchan']",186,7.9,,"72,372","1,787,378",2003
568,Taeksi woonjunsa,Action Drama History,A widowed father and taxi driver who drives a German reporter from Seoul to Gwangju to cover the 1980 uprising soon finds himself regretting his decision after being caught in the violence around him,Hun Jang,"['Song Kang-ho', 'Thomas Kretschmann', 'Hae-Jin Yoo', 'Ryu Jun-Yeol']",137,7.9,69,"28,020","1,527,829",2017
569,The Adventures of Robin Hood,Action Adventure Romance,When Prince John and the Norman Lords begin oppressing the Saxon masses in King Richards absence in 1190s England a Saxon lord fights back as the outlaw leader of a resistance movement,Michael Curtiz,"['William Keighley', 'Errol Flynn', 'Olivia de Havilland', 'Basil Rathbone', 'Claude Rains']",102,7.9,97,"53,101","3,981,000",1938
